event_date,news_count_total,news_count_pre_open,news_count_intraday,pre_open_flag,intraday_flag,top_headline,top_source,prev_close,open_price,open_gap_pct,day_high_rth,open_to_high_pct_rth,close_price,open_to_close_pct,tplus1_return_pct,tplus3_return_pct,event_volume,avg_volume_6mo,volume_spike_ratio,time_to_high_minutes,firsthour_open_to_high_pct
2020-12-16,4,3,1,True,True,"Cannabis Stocks Move Higher Amid Report Tilray, Aphria In Advanced Merger Talks",,7.86,9.95,26.590330788804057,10.0,0.5025125628140775,9.33,-6.231155778894465,-3.9657020364415776,-10.128617363344054,982565.0,,,215.0,0.0
2020-12-17,3,1,2,True,True,Flowr Reports Strategic Warehousing Deal With Tilray To 'take a collaborative approach to furthering their cannabis businesses in the European Union',,9.33,9.35,0.2143622722400812,9.4,0.5347593582887776,8.96,-4.171122994652394,-0.8370535714285832,-5.636160714285722,245570.0,,,0.0,0.5347593582887776
2020-12-21,1,1,0,True,False,"The Week In Cannabis: Tilray-Aphria Merge, Aurora Continues Layoffs, Financings, Earnings, M&A",,8.885,8.53,-3.9954980303882994,8.845,3.6928487690504253,8.385,-1.6998827667057397,0.8348240906380475,2.2063208109719796,220444.0,,,25.0,3.6928487690504253
2020-12-23,1,0,1,False,True,Cannabis Stocks Spike Higher On Volume,,8.455,8.55,1.1235955056179852,9.3,8.771929824561402,8.895,4.0350877192982315,-3.65373805508712,-7.700955593029778,212263.0,,,319.0,0.760233918128649
2020-12-29,2,0,2,False,True,Cannabis Countdown: Top 10 Marijuana And Psychedelic Stock News Stories Of The Week,,8.365,8.46,1.1356843992827332,8.48,0.23640661938533772,8.21,-2.9550827423167845,4.8721071863580825,9.622411693057236,89741.0,,,2.0,0.23640661938533772
2020-12-30,1,0,1,False,True,Cannabis Stocks At New Session Highs,,8.21,8.21,0.0,8.76,6.699147381242374,8.61,4.8721071863580825,-4.065040650406501,10.394889663182362,81047.0,,,260.0,2.070645554202191
2021-01-04,2,2,0,True,False,'492K cannabis arrest records expunged years early' -23 WIFR Report,,8.26,8.435,2.1186440677966187,9.18,8.832246591582681,9.0,6.698280972139887,5.61111111111112,26.111111111111107,188272.0,,,36.0,8.832246591582681
2021-01-06,2,0,2,False,True,Cannabis Stocks Mover Higher; New York Governor Cuomo Announces Proposal To Legalize Cannabis Program; Says Legalization Expected To Generate Over $300M In Tax Revenue,,9.505,11.01,15.833771699105723,12.0,8.99182561307902,10.765,-2.2252497729336898,5.434277751973981,14.259173246632606,500791.0,,,264.0,2.452316076294274
2021-01-11,2,1,1,True,True,The Week In Cannabis: Stocks Surge On Heels Of Georgia Runoff; NY Legalization; M&A And Financings Spike,,11.32,11.05,-2.385159010600703,12.715,15.067873303167412,12.3,11.312217194570135,8.455284552845521,50.81300813008129,292709.0,,,150.0,11.583710407239813
2021-01-15,1,1,0,True,False,"Cannabis Stocks Higher After Hours: Aurora Cannabis Shares Up 4.8%, Aphria, Sundial Growers Up 4%, Tilray Up 3.7%, Canopy Growth, Cronos Up 2%",,18.55,21.56,16.22641509433961,22.555,4.615027829313548,19.7,-8.627087198515767,1.954314720812191,-9.086294416243652,1338337.0,,,16.0,4.615027829313548
2021-01-21,1,0,1,False,True,Why Cannabis Stocks Are Trading Lower Today,,18.805,18.07,-3.9085349641052884,18.29,1.2174875484227938,17.91,-0.8854454897620373,0.5583472920156416,6.253489670575103,270527.0,,,3.0,1.2174875484227938
2021-01-26,1,1,0,True,False,Tilray Selected By French National Agency To Supply GMP-Certified Medical Cannabis Products To Patients For A Medical Cannabis Experiment,,17.19,18.21,5.933682373472946,19.81,8.786381109280603,19.03,4.503020318506317,-2.1019442984761016,-4.676826064109304,345878.0,,,25.0,8.786381109280603
2021-01-29,1,0,1,False,True,"Cannabis Stocks Move Higher; Traders Circulate Stifel Note Saying 'We Have Learned That Senate Majority Leader Chuck Shumer Has Confirmed He, Along With Dem. Senators And Some Republicans, Are Crafting A Federal Cannabis Reform Bill'",,18.715,18.78,0.34731498797756494,20.4,8.626198083067079,18.14,-3.407880724174657,5.071664829106936,44.90077177508269,343364.0,,,107.0,0.7454739084132085
2021-02-01,6,3,3,True,True,"The Week In Cannabis: Arizona Adult-Use Sales, Big Financings, M&A, And A Nasdaq Debut",,18.14,19.02,4.85115766262403,19.48,2.418506834910625,19.06,0.21030494216613643,23.137460650577125,40.55613850996853,231410.0,,,363.0,0.0
2021-02-02,2,0,2,False,True,Cannabis Stocks Mark New Session Highs: Tilray Up 15%; Cronos Group Up Up 12%; Aphria Up 10%; Canopy Growth Up 6.5%; AbbVie Up 1.3%,,19.06,19.72,3.4627492130115436,24.055,21.982758620689662,23.47,19.016227180527384,11.99403493821901,9.629314017895192,691043.0,,,382.0,8.620689655172429
2021-02-03,3,2,1,True,True,"Marijuana Stocks Move Higher Following Jazz Pharma Deal For GW Pharma; BZ NOTE: GW Pharma Was One Of The First Pharma Companies To Use Cannabinoids For Medical Therapy For Epilepsy, Other Forms Of Seizure, Etc.",,23.47,25.4,8.223263740945889,28.8,13.385826771653553,26.285,3.4842519685039433,1.9212478599961917,14.628114894426474,869447.0,,,102.0,7.559055118110243
2021-02-05,1,0,1,False,True,"Cannabis Stocks Spiked Higher About An Hour Ago Following Bloomberg Headline Republican, Democrat Senators Introduced A Bill To Expand Marijuana Research",,26.79,27.11,1.1944755505785751,27.32,0.7746219107340496,25.73,-5.0903725562523015,17.100660707345504,147.84298484259622,175371.0,,,107.0,0.35042419771301686
2021-02-08,1,1,0,True,False,"The Week In Cannabis: Stocks Up By Double-Digits On Jazz Pharma's GWPH Acquisition, Potential Federal Moves",,25.73,26.3,2.2153128643606697,30.56,16.1977186311787,30.13,14.562737642585544,40.292067706604726,6.903418519747766,343145.0,,,171.0,7.946768060836501
2021-02-09,1,1,0,True,False,Is Tilray Set For Another Short Squeeze?,,30.13,35.1,16.495187520743453,45.44,29.458689458689445,42.27,20.427350427350433,50.86349656967116,-31.263307310149045,1282265.0,,,99.0,9.430199430199417
2021-02-16,3,1,2,True,True,"This Week In Cannabis: Tilray, Aphria, Sundial Go For A Ride; ETFs Pop With CNBS Advancing 99%",,29.055,31.04,6.83187059025985,36.3,16.94587628865979,34.59,11.436855670103107,-8.788667244868465,-15.437987857762367,470562.0,,,246.0,3.7048969072164906
2021-02-18,5,4,1,True,True,Tilray Says Deal With Aphria Expected To Close In Q2'21,,31.55,33.035,4.706814580031683,35.09,6.220675041622543,27.11,-17.93552293022551,7.893766137956476,-8.520841018074506,366804.0,,,3.0,6.220675041622543
2021-02-19,1,1,0,True,False,Tilray CEO Touts Many 'Cannabis Firsts' In Glowing Letter To Employees After Earnings Call,,27.11,27.83,2.655846551088155,29.83,7.186489399928135,29.25,5.102407473948983,-10.119658119658123,-4.410256410256407,111841.0,,,94.0,4.707150556952937
2021-02-22,5,2,3,True,True,3 Reasons Cannabis Stocks May Be Headed Lower,,29.25,27.245,-6.854700854700852,28.815,5.762525233987889,26.29,-3.5052303174894544,-5.667554203119051,-6.808672499049065,218169.0,,,220.0,3.395118370343185
2021-02-24,1,1,0,True,False,"Cannabis Stock Gainers And Losers From February 23, 2021",,24.8,25.485,2.762096774193543,28.17,10.535609181871699,27.96,9.71159505591525,-12.374821173104438,-8.547925608011447,99648.0,,,386.0,3.9827349421228195
2021-02-25,1,1,0,True,False,Hearing 'Alabama Senate Passes The Medical Marijuana Bill 21-8. It Now Moves To The House.',,27.96,26.8,-4.148783977110158,27.57,2.8731343283582076,24.5,-8.58208955223881,-0.5714285714285737,5.755102040816327,160578.0,,,10.0,2.8731343283582076
2021-03-16,1,0,1,False,True,"'NYS Senate leader on status of talks to legalize recreational marijuana. ""We have reached a little bit of an impasse right now on impaired driving""' -Tweet",,30.48,30.54,0.1968503937007832,30.54,0.0,26.97,-11.689587426326131,1.983685576566556,-6.06229143492769,566707.0,,,0.0,0.0
2021-03-18,3,1,2,True,True,"'Cannabis banking bill will be reintroduced in the House tomorrow by @RepPerlmutter. The bill passed the House 321-103 in 2019, then stalled in the Senate' -Tweet From POLITICO Cannabis Reporter",,27.505,26.93,-2.0905289947282286,28.085,4.288897140735243,25.3,-6.052729298180464,0.13833992094861716,-8.181818181818183,181565.0,,,69.0,3.6019309320460415
2021-03-23,1,0,1,False,True,'New York Lawmakers Overcome Marijuana Legalization 'Impasse' And Expect Bill In 'Next Day Or So' -MarijuanaMoment Report,,23.9,23.24,-2.7615062761506284,24.65,6.0671256454388995,23.23,-0.04302925989672122,-4.433921653034874,-5.165733964700815,266480.0,,,262.0,3.829604130808953
2021-03-24,4,0,4,False,True,"Tilray Shares Spike Higher, New York Governor Cuomo Says Cannabis Legalization Is Top Priority",,23.23,23.36,0.5596211795092509,24.42,4.537671232876722,22.2,-4.965753424657534,2.882882882882886,-2.657657657657657,197411.0,,,270.0,0.834760273972604
2021-03-26,1,1,0,True,False,"Watching Cannabis Stocks Following Report 'Virginia Governor Signals He'll Push To Legalize Marijuana On July 1, Ahead Of Schedule' -Tweet From Cannabis News Publication, Marijuana Moment",,22.84,23.235,1.7294220665499107,23.235,0.0,22.03,-5.186141596729065,-1.9064911484339615,3.268270540172487,64495.0,,,0.0,0.0
2021-03-31,3,1,2,True,True,3 Cannabis Stocks Looking For Support: Technical Levels To Watch,,21.99,22.965,4.43383356070942,24.04,4.681036359677767,22.75,-0.9362072719355534,-1.8461538461538536,-7.120879120879126,100890.0,,,29.0,4.681036359677767
2021-04-07,1,0,1,False,True,"Tilary Shares See Volume; Traders Circulate Politico Reporter Tweet Highlighting Alcohol, Tobacco Tax And Trade Bureau Has Been Meeting With National Cannabis Groups",,21.13,20.76,-1.7510648367250234,20.93,0.8188824662813012,19.76,-4.816955684007707,0.05060728744938264,-13.259109311740893,116390.0,,,5.0,0.8188824662813012
2021-04-12,3,1,2,True,True,"Cannabis Analyst: March Earning Season May Not Push Canadian LPs, But There Are Other Catalysts",,19.78,17.95,-9.251769464105166,18.11,0.8913649025069647,17.14,-4.512534818941497,6.88448074679113,-1.1668611435239165,346341.0,,,0.0,0.8913649025069647
2021-04-15,4,1,3,True,True,"Cannabis Stock Gainers And Losers From April 14, 2021",,17.39,17.67,1.6101207590569357,18.42,4.244482173174872,16.94,-4.1312959818902115,1.446280991735522,-6.286894923258567,176329.0,,,8.0,4.244482173174872
2021-04-16,1,0,1,False,True,"'Marijuana Banking Bill Expected To Get A House Floor Vote Next Week, Sponsor's Office Says' -Marijuana Moment",,16.94,16.68,-1.5348288075560894,17.26,3.477218225419675,17.185,3.027577937649874,1.3674716322374338,-2.269421006691865,98395.0,,,79.0,1.5587529976019279
2021-04-19,1,1,0,True,False,"The Week In Cannabis: New Mexico, Switzerland, Federal Legalization, Aphria, Organigram And More",,17.185,17.21,0.14547570555718436,18.48,7.379430563625797,17.42,1.220220801859389,-8.869115958668207,-5.510907003444322,175141.0,,,26.0,7.379430563625797
2021-04-20,3,0,3,False,True,"Cannabis Countdown: Top 10 Marijuana And Psychedelic Stock News Stories Of The Week, 4/20/2021",,17.42,18.02,3.4443168771526853,18.15,0.7214206437291844,15.875,-11.90344062153163,5.795275590551192,7.653543307086613,140347.0,,,1.0,0.7214206437291844
2021-04-21,2,1,1,True,True,"Aphria CEO Discusses Tilray Merger On 420, Says Combined Company 'Will Be Ready' For US Legalization",,15.875,15.4,-2.9921259842519663,16.81,9.155844155844145,16.795,9.058441558441567,-1.9946412622804455,6.1030068472759655,119887.0,,,386.0,6.233766233766228
2021-04-22,1,1,0,True,False,"Cannabis Stock Gainers And Losers From April 21, 2021",,16.795,17.02,1.3396844298898354,17.11,0.528789659224441,16.46,-3.2902467685076306,3.8274605103280614,7.685297691373029,99675.0,,,191.0,0.0
2021-04-26,1,1,0,True,False,"Video: Benzinga Cannabis Insider 4/23 | ETFs, Michigan Market, Verano, Tilray, GrowGen & More!",,17.09,17.11,0.11702750146284127,17.84,4.266510812390418,17.82,4.149620105201642,-0.5331088664421934,4.657687991021315,71582.0,,,352.0,1.8118059614260802
2021-04-27,1,1,0,True,False,"Cannabis Stock Gainers And Losers From April 26, 2021",,17.82,18.16,1.9079685746352406,18.4,1.3215859030836918,17.725,-2.3953744493392,9.167842031029618,3.469675599435816,121291.0,,,8.0,1.3215859030836918
2021-04-28,2,0,2,False,True,"BofA On Cannabis Stocks: Bullish On Tilray, Canopy Growth, Bearish On Cronos",,17.725,17.765,0.22566995768687811,19.57,10.160427807486629,19.35,8.922037714607377,-3.6175710594315387,-12.041343669250654,289387.0,,,371.0,2.6175063326766104
2021-04-30,3,1,2,True,True,"20 Picks From The 2021 CNBC 'Stock Draft': Bitcoin, Amazon, Ark Lead The Way",,18.65,18.22,-2.3056300268096503,19.23,5.543358946212962,18.34,0.6586169045005543,-7.197382769901855,-13.195201744820064,231826.0,,,28.0,5.543358946212962
2021-05-03,3,2,1,True,True,"The Week In Cannabis: PA, MD, Big Tobacco, GTI, Sundial, MedMen, Earnings, Financings And More",,18.34,18.5,0.872410032715377,18.59,0.4864864864864857,17.02,-8.000000000000004,-5.405405405405395,-17.009400705052876,382101.0,,,11.0,0.4864864864864857
2021-05-04,5,2,3,True,True,Video: CEO Irwin Simon Breaks Down The Tilray-Aphria Merger | Benzinga Cannabis Insider,,17.02,16.66,-2.115158636897764,17.0,2.0408163265306114,16.1,-3.361344537815118,-1.1180124223602574,0.43478260869565394,326110.0,,,2.0,2.0408163265306114
2021-05-05,2,1,1,True,True,"Video: Benzinga Cannabis Insider 5/04 Ft. Aurora, Tilray, Sundial, Hydrofarm & More",,16.1,16.24,0.8695652173912858,16.65,2.524630541871922,15.92,-1.9704433497536855,-11.275125628140703,-5.433417085427137,297016.0,,,25.0,2.524630541871922
2021-05-06,1,0,1,False,True,"Cannabis Movers & Shakers: Phyto, HERBL, Treez, Fyllo, Auxly, AgraFlora, Viridis",,15.92,15.58,-2.1356783919597984,15.59,0.06418485237483816,14.125,-9.338896020539153,14.477876106194703,10.725663716814163,384949.0,,,0.0,0.06418485237483816
2021-05-07,2,1,1,True,True,"Cannabis Stock Gainers And Losers From May 6, 2021",,14.125,15.3,8.318584070796465,17.01,11.176470588235299,16.17,5.686274509803928,-6.89548546691405,-10.111317254174406,1461435.0,,,126.0,8.039215686274511
2021-05-18,1,1,0,True,False,"Cannabis Stock Gainers And Losers From May 17, 2021",,15.13,15.03,-0.6609385327164667,15.87,5.5888223552894205,15.59,3.725881570192951,-3.84862091084028,-2.277100705580503,224924.0,,,116.0,4.790419161676651
2021-05-20,3,0,3,False,True,Altria Says Believes Legal Cannabis 'Should Happen' In U.S.,,14.99,15.1,0.7338225483655733,15.545,2.947019867549671,14.93,-1.125827814569536,2.042866711319489,3.482920294708638,181895.0,,,26.0,2.947019867549671
2021-05-21,4,0,4,False,True,Cannabis Stocks Move Higher; Traders Circulate MJUS Report 'Key Chairman Plans To File Revised Federal Marijuana Legalization Bill In House As Early As Next Week',,14.93,15.09,1.071667782987275,15.43,2.253147779986745,15.235,0.9609012591119919,-1.4112241549064646,9.419100754840843,227599.0,,,257.0,1.0603048376408226
2021-05-24,2,0,2,False,True,"ResearchAndMarkets Report: Medical Cannabis Market To Hit $49.1B By 2028, CAGR: 23.9%",,15.235,15.21,-0.16409583196585875,15.42,1.3806706114398362,15.02,-1.2491781722551036,2.862849533954725,14.181091877496666,225110.0,,,21.0,1.3806706114398362
2021-05-25,1,0,1,False,True,"Aurora Cannabis Begins Trading On Nasdaq, CEO Shares 2021 Plans, Focus On The Key Markets",,15.02,15.1,0.5326231691078567,16.45,8.940397350993376,15.45,2.3178807947019844,7.896440129449854,8.025889967637553,582787.0,,,79.0,7.483443708609277
2021-05-27,1,1,0,True,False,"Cannabis Stock Gainers And Losers From May 26, 2021",,16.67,16.99,1.919616076784623,17.195,1.2065921130076624,17.15,0.9417304296645095,-2.6822157434402176,10.845481049562702,348194.0,,,388.0,0.7651559741024283
2021-05-28,2,0,2,False,True,'Bill To Federally Legalize Marijuana Reintroduced In Congress As Senate Prepares Separate Measure' -Marijuana Moment,,17.15,17.16,0.05830903790088375,18.725,9.120046620046628,16.69,-2.7389277389277322,1.7375674056321098,18.454164170161764,783436.0,,,47.0,9.120046620046628
2021-06-02,1,0,1,False,True,Cannabis Stocks Move To New Session Highs; Traders Circulate Word Bill In State Of Louisiana To Legalize Smokeable Medical Marijuana Is Moving To Governor's Desk; BZ NOTE: Senate Approved Bill Last Week,,16.98,17.315,1.972909305064787,19.14,10.539994224660694,19.01,9.789200115506787,3.9978958442924672,3.7874802735402358,614625.0,,,347.0,2.3390124169794833
2021-06-03,3,2,1,True,True,"Cannabis Stock Gainers And Losers From June 2, 2021",,19.01,20.66,8.679642293529714,22.14,7.163601161665055,19.77,-4.307841239109393,-4.855842185128988,2.250885179564999,1331929.0,,,7.0,7.163601161665055
2021-06-04,3,1,2,True,True,"Cannabis Stock Gainers And Losers From June 3, 2021",,19.77,20.26,2.4785027819929284,20.46,0.9871668311944682,18.81,-7.156959526159934,4.891015417331216,13.87559808612442,470614.0,,,0.0,0.9871668311944682
2021-06-07,2,1,1,True,True,"Cannabis Stock Gainers And Losers From June 4, 2021",,18.81,19.01,1.0632642211589731,20.175,6.128353498158859,19.73,3.7874802735402358,2.4581855043081573,1.5205271160669067,450542.0,,,206.0,4.129405576012625
2021-06-08,2,1,1,True,True,"Cannabis Stock Gainers And Losers From June 7, 2021",,19.73,20.13,2.027369488089197,20.5,1.8380526577247938,20.215,0.42225534028813144,5.960920108830086,-1.5582488251298603,402573.0,,,81.0,1.0928961748633998
2021-06-09,2,1,1,True,True,"Cannabis Stock Gainers And Losers From June 8, 2021",,20.215,20.64,2.102399208508537,23.025,11.555232558139524,21.42,3.779069767441866,-6.489262371615315,-10.597572362278258,932700.0,,,315.0,7.655038759689914
2021-06-17,1,0,1,False,True,'Florida Supreme Court Kills Another Marijuana Legalization Ballot Measure For 2022' -Marijuana Moment,,18.12,18.01,-0.607064017660041,18.36,1.9433647973348018,17.485,-2.9150471960022326,-3.174149270803545,-0.31455533314269213,301988.0,320792.59523809527,0.9413808313619636,55.0,1.9433647973348018
2021-06-18,2,1,1,True,True,"Cannabis Stock Gainers And Losers From June 17, 2021",,17.485,17.39,-0.5433228481555554,17.74,2.0126509488211495,16.93,-2.645198389879246,2.569403425871227,4.01653868871825,339461.0,321509.72222222225,1.0558343233097323,19.0,2.0126509488211495
2021-06-22,4,2,2,True,True,Cantor Fitzgerald's Cannabis Conference: A Recap For Investors,,17.365,17.25,-0.6622516556291301,17.44,1.1014492753623262,17.43,1.0434782608695636,1.032702237521513,4.36029833620196,195147.0,316892.5,0.6158145112301491,8.0,1.1014492753623262
2021-06-23,2,0,2,False,True,Watching Cannabis Stocks; Marijuana Moment Reports 'Congressional Democrats Defy Biden By Scrapping D.C. Marijuana Sales Ban',,17.43,17.59,0.9179575444635694,18.17,3.2973280272882426,17.61,0.11370096645821248,3.6910846110164797,5.792163543441224,189034.0,317666.15873015876,0.5950712557977407,61.0,3.0699260943717976
2021-06-24,1,0,1,False,True,"Watching Cannabis Stocks, Cronos Group Shares Spike To Session High Following Report From Marijuana Moment 'House Committee Approves Marijuana Protections For Banking And D.C.'",,17.61,17.96,1.9875070982396448,18.67,3.953229398663702,18.26,1.670378619153679,-0.3833515881708668,-2.135815991237681,238295.0,317416.873015873,0.7507319876725129,70.0,1.7260579064587902
2021-06-28,2,1,1,True,True,"The Week In Cannabis: CT Goes Legal, O'Brien Smokes On TV, A New Extraction Giant And More",,18.19,18.18,-0.05497526113249897,19.14,5.280528052805286,18.63,2.4752475247524717,-4.079441760601171,-4.455179817498649,229385.0,318014.3968253968,0.7213038223736202,109.0,4.840484048404835
2021-06-29,2,1,1,True,True,"Tilray, KushCo And Aurora Among Top Cannabis Stock Movers On June 28, 2021",,18.63,18.66,0.16103059581321064,19.21,2.9474812433011826,17.87,-4.233654876741689,1.175153889199761,-3.5534415221040936,196165.0,319356.6746031746,0.6142505092268705,29.0,2.9474812433011826
2021-06-30,4,2,2,True,True,"Item 9 Labs, TerrAscend, MariMed And MedMen Among Top Cannabis Stock Movers On June 29, 2021",,17.87,17.87,0.0,18.4,2.9658645775041834,18.08,1.175153889199761,-1.5486725663716683,-7.522123893805308,242866.0,320333.5317460318,0.7581660236323623,130.0,0.1119194180190239
2021-07-01,4,1,3,True,True,Sundial vs Tilray vs Aurora Cannabis: Which Retail-Favorite Cannabis Stock Gave Best Returns In First-Half Of 2021?,,18.08,18.03,-0.27654867256635596,18.395,2.024403771491949,17.8,-1.2756516916250717,-3.1741573033707935,-8.764044943820238,173786.0,321548.8095238095,0.5404653814684136,70.0,0.38824181919024003
2021-07-02,2,1,1,True,True,Watch Khiron Life Sciences & Jason Wild On The Benzinga Cannabis Hour,,17.8,17.74,-0.337078651685406,17.9,0.9019165727170245,17.235,-2.8466741826381003,-2.98810559907166,-5.947200464171735,137603.0,322284.8333333333,0.4269608301973048,8.0,0.9019165727170245
2021-07-06,1,1,0,True,False,"Urban-gro, Khiron Life Sciences & CURE Pharmaceutical Among Top Cannabis Stock Movers On July 1, 2021",,17.235,17.25,0.08703220191471174,17.46,1.217391304347831,16.72,-3.0724637681159486,-2.8708133971291896,-3.2894736842105097,127707.0,322552.873015873,0.39592578669642003,2.0,1.217391304347831
2021-07-07,1,0,1,False,True,Tilray's First Harvest And Distribution Of Medical Cannabis In Germany Successfully Completed,,16.72,16.76,0.23923444976078173,16.91,0.8949880668257671,16.24,-3.102625298329374,-0.18472906403939401,0.0,255977.0,322072.1984126984,0.7947814224933348,3.0,0.8949880668257671
2021-07-19,3,0,3,False,True,'Missouri Marijuana Activists File Legalization Initiatives For 2022 As Other Groups Prepare Separate Measures' -Marijuana Moment,,13.925,13.35,-4.129263913824064,13.78,3.2209737827715337,13.605,1.9101123595505678,4.116133774347657,2.0213156927600173,286406.0,312809.6746031746,0.9155918862270808,147.0,2.8464419475655487
2021-07-21,2,1,1,True,True,"Bullish Sentiment Pumps Up Cannabis Stocks: Tilray, Sundial, Aurora & GrowGen Among Top Cannabis Movers For July 20, 2021",,14.165,14.19,0.17649135192375826,14.885,4.897815362931644,14.59,2.818886539816775,-4.866346812885531,-6.305688827964359,185893.0,303310.00793650793,0.6128811946057285,128.0,3.1712473572938764
2021-07-22,3,2,1,True,True,"Bullish Trend Continues In Cannabis Market: Tilray, Canopy Growth & GrowGen Among Top Cannabis Movers For July 21, 2021",,14.59,14.48,-0.7539410555174738,14.515,0.24171270718232143,13.88,-4.143646408839777,-2.089337175792514,-8.285302593659944,190122.0,303269.9603174603,0.6269067988170737,5.0,0.24171270718232143
2021-07-23,5,4,1,True,True,'Chuck Schumer Discusses Strategy For Getting Enough Votes To Pass Marijuana Legalization Bill' -Marijuana Moment,,13.88,13.92,0.28818443804033966,13.92,0.0,13.59,-2.3706896551724146,0.588668138337013,17.77041942604856,164821.0,302631.8253968254,0.5446254695251526,0.0,0.0
2021-07-26,2,1,1,True,True,"AusCann, Flower One, Item 9 Labs & MariMed Among Top Cannabis Stock Movers On July 23, 2021",,13.59,13.44,-1.1037527593819012,14.13,5.133928571428581,13.67,1.711309523809527,-6.876371616678856,12.765179224579365,166428.0,302419.71428571426,0.5503212659038669,57.0,5.133928571428581
2021-07-27,2,0,2,False,True,Tilray Stock Rides Key Level Into Earnings: What's Next?,,13.67,13.45,-1.609363569861014,13.62,1.263940520446096,12.73,-5.353159851301107,25.72663000785545,14.728986645718775,278189.0,301310.79365079367,0.9232626439609367,5.0,1.263940520446096
2021-07-28,8,4,4,True,True,"AusCann, Meridian Bioscience & General Cannabis Among Top Cannabis Stock Movers On July 27, 2021",,12.73,14.23,11.78318931657502,16.485,15.846802529866471,16.005,12.47364722417427,-3.6863480162449225,-8.809746954076841,960149.0,300773.57936507935,3.1922650986394316,335.0,13.703443429374557
2021-08-11,1,0,1,False,True,"As The Cannabis Industry Blossoms, So Do CEO Paychecks: M&A Deals Extremely Lucrative For Execs In High Places",,14.79,14.72,-0.4732927653820048,14.79,0.47554347826085946,14.305,-2.819293478260876,-1.5029709891646268,-8.388675288360709,198831.0,281426.4682539682,0.7065113712778734,0.0,0.47554347826085946
2021-08-18,4,2,2,True,True,"MedMen Announces $100M Equity Investment On Heels Of Tilray Buying Its Convertible Debt, Deal Led By Serruya Private Equity",,13.115,13.94,6.290507052992751,14.035,0.681492109038742,13.27,-4.8063127690100425,-4.559155990957049,0.7535795026375256,224220.0,248585.02380952382,0.9019851500459122,1.0,0.681492109038742
2021-08-19,3,0,3,False,True,'Rosario Dawson Joins Board Of Marijuana Business As Partner Cory Booker Pushes For Legalization In Senate' -Marijuana Moment,,13.27,13.035,-1.770911831198187,13.325,2.2247794399693066,12.665,-2.8385116992712005,1.2238452427951136,8.961705487564165,122988.0,247453.40476190476,0.49701478190747406,2.0,2.2247794399693066
2021-08-20,2,1,1,True,True,"Aurora, Sundial And Tilray Fall: A Look Into The Top Marijuana Stock Movers From Today",,12.665,12.69,0.19739439399921324,13.005,2.4822695035461093,12.82,1.0244286840031582,4.290171606864266,5.61622464898595,98841.0,247541.87301587302,0.3992900223133646,88.0,1.576044129235627
2021-08-23,3,1,2,True,True,"The Week In Cannabis: PharmaCann Could IPO, Tilray & MedMen, First Black CEO At Major Public Co. And More",,12.82,12.97,1.1700468018720778,13.4,3.3153430994602906,13.37,3.084040092521192,3.216155572176526,-0.9349289454001496,89922.0,246594.82539682538,0.3646548537881754,237.0,1.387818041634539
2021-08-24,3,2,1,True,True,"'Texas Ban On Smokeable Hemp Manufacturing And Sales Is Unconstitutional, Judge Rules' -Marijuana Moment",,13.37,13.44,0.5235602094240859,13.81,2.7529761904761982,13.8,2.6785714285714377,-1.884057971014504,-2.717391304347826,93732.0,246471.0158730159,0.38029623754336933,389.0,1.6369047619047667
2021-08-25,5,2,3,True,True,'New Mexico Officials File Marijuana Producer Rules And Will Accept License Applications This Week' -Marijuana Moment,,13.8,13.61,-1.3768115942029078,13.8,1.3960323291697376,13.54,-0.5143277002204283,-2.178729689807976,-2.9542097488921613,95748.0,246424.0634920635,0.3885497164650226,64.0,1.2490815576781773
2021-08-26,4,0,4,False,True,'Third North Carolina Senate Committee Approves Medical Marijuana Legalization Bill' -Marijuana Moment,,13.54,13.475,-0.48005908419497423,13.76,2.115027829313545,13.245,-1.7068645640074245,1.359003397508505,3.3597583993960005,153032.0,245909.53968253967,0.622310139726823,38.0,2.115027829313545
