event_date,news_count_total,news_count_pre_open,news_count_intraday,pre_open_flag,intraday_flag,top_headline,top_source,prev_close,open_price,open_gap_pct,day_high_rth,open_to_high_pct_rth,close_price,open_to_close_pct,tplus1_return_pct,tplus3_return_pct,event_volume,avg_volume_6mo,volume_spike_ratio,time_to_high_minutes,firsthour_open_to_high_pct
2024-02-21,1,1,0,True,False,"Cannabis Stock Gainers And Losers From February 20, 2024",benzinga,1.8,1.8,0.0,1.8,0.0,1.775,-1.3888888888888962,0.28169014084507693,-1.4084507042253471,357808.0,257677.03968253967,1.3885909293308496,0.0,0.0
2024-02-22,3,1,2,True,True,"Tilray's Premium Cannabis Wellness Brand, Solei, Launches New Cannabis Infused Cold Brew Teas",benzinga,1.775,1.8,1.4084507042253596,1.805,0.27777777777777185,1.78,-1.111111111111112,-1.6853932584269677,1.1235955056179785,171194.0,259562.38095238095,0.659548580853121,300.0,0.0
2024-02-26,2,2,0,True,False,Tilray Medical Applauds German Bundestag And  Landmark Passage Of Medical Cannabis Act In Germany,benzinga,1.75,1.73,-1.142857142857144,1.775,2.6011560693641576,1.75,1.1560693641618507,2.85714285714286,-0.571428571428572,61089.0,263836.44444444444,0.23154117365640667,28.0,2.6011560693641576
2024-02-27,1,1,0,True,False,Cannabis Stocks Gear Up For Germany's New Market: Check Out Who's Set To Win Big,benzinga,1.75,1.78,1.7142857142857157,1.845,3.651685393258424,1.8,1.1235955056179785,-2.5000000000000084,-4.166666666666664,109995.0,262932.22222222225,0.4183397495763589,329.0,0.0
2024-02-28,3,2,1,True,True,"Bullish Sentiment Across The Cannabis Space - Check Full Movers For February 27, 2024",benzinga,1.8,1.77,-1.666666666666668,1.805,1.9774011299434981,1.755,-0.847457627118651,-0.8547008547008492,-3.4188034188034093,102316.0,262480.04761904763,0.38980486680076,179.0,0.8474576271186385
2024-03-01,4,0,4,False,True,"Aurora Cannabis Bounces Back: Debt Paid, Growth Ahead",benzinga,1.74,1.74,0.0,1.76,1.1494252873563229,1.725,-0.8620689655172358,-1.7391304347826102,-4.927536231884068,92634.0,263470.51587301586,0.3515915232224563,166.0,0.0
2024-03-05,1,0,1,False,True,Is Cannabis Replacing Beer? Canadian Study Links Weed Legalization To Drop In Alcohol Sales,benzinga,1.695,1.68,-0.8849557522123966,1.685,0.2976190476190545,1.65,-1.7857142857142874,-0.6060606060606066,3.333333333333343,264668.0,252857.85714285713,1.0467066477213343,217.0,0.0
2024-03-11,2,1,1,True,True,"Bullish Sentiment Across The Cannabis Space - Check Full Movers For March 8, 2024",benzinga,1.705,1.68,-1.4662756598240547,1.725,2.6785714285714377,1.68,0.0,-0.2976190476190413,-4.166666666666657,97000.0,243118.14285714287,0.3989829753553093,14.0,2.6785714285714377
2024-03-14,3,1,2,True,True,Tilray Brands Announced Receiving Approval For First Medical Cannabis Extract In Portugal,benzinga,1.675,1.67,-0.2985074626865741,1.67,0.0,1.61,-3.592814371257475,7.453416149068315,18.633540372670794,118920.0,228628.09523809524,0.5201460471258167,0.0,0.0
2024-03-15,2,1,1,True,True,"Cannabis Stock Gainers And Losers From March 14, 2024",benzinga,1.61,1.61,0.0,1.74,8.074534161490677,1.73,7.453416149068315,10.693641618497113,13.872832369942195,143606.0,226019.29365079364,0.635370537091738,339.0,2.795031055900617
2024-03-18,2,1,1,True,True,"Cannabis Stock Movers For March 15, 2024",benzinga,1.73,1.82,5.202312138728328,2.03,11.538461538461524,1.915,5.219780219780218,-0.26109660574413135,2.349869451697124,456083.0,222985.88095238095,2.0453447458289853,188.0,5.4945054945054865
2024-03-19,1,1,0,True,False,"Bullish Monday For Marijuana Stocks - Greenlane Hldgs, Heritage Cannabis Holding Among Top Gainers",benzinga,1.915,1.87,-2.349869451697124,1.95,4.278074866310152,1.91,2.13903743315507,3.141361256544505,20.680628272251322,271001.0,223612.39682539683,1.2119229695999618,300.0,0.5347593582887586
2024-03-20,1,1,0,True,False,"Cannabis Stock Gainers And Losers From March 19, 2024",benzinga,1.91,1.94,1.5706806282722525,2.01,3.6082474226804044,1.97,1.546391752577321,-0.5076142131979701,9.137055837563448,187723.0,218455.2142857143,0.8593202987340001,153.0,2.061855670103095
2024-03-21,1,0,1,False,True,Tilray's Redecan Launches Spring Lineup As Medical Cannabis Giant Ramps Up Its 'Diversification' Strategy,benzinga,1.97,1.96,-0.5076142131979701,2.02,3.061224489795921,1.96,0.0,17.602040816326543,17.857142857142865,149074.0,216655.20634920636,0.6880702407848972,15.0,3.061224489795921
2024-03-22,2,0,2,False,True,What's Going On With Marijuana Stocks Tilray And Canopy Growth As Germany Legalizes Pot?,benzinga,1.96,1.98,1.020408163265307,2.37,19.696969696969706,2.305,16.414141414141422,-6.724511930585694,7.8091106290672325,789052.0,216003.3650793651,3.6529616087697634,379.0,11.616161616161616
2024-03-25,3,1,2,True,True,"Cannabis Stock Gainers And Losers From March 22, 2024",benzinga,2.305,2.3,-0.216919739696327,2.365,2.8260869565217566,2.15,-6.52173913043478,7.441860465116286,14.883720930232572,426340.0,220380.8015873016,1.9345605285454495,3.0,2.8260869565217566
2024-03-26,1,1,0,True,False,"Cannabis Stock Gainers And Losers From March 25, 2024",benzinga,2.15,2.16,0.4651162790697782,2.45,13.425925925925927,2.31,6.944444444444439,7.575757575757567,4.761904761904756,576893.0,222779.00793650793,2.5895303392517786,117.0,7.638888888888889
2024-03-27,2,1,1,True,True,"Cannabis Stock Movers For March 26, 2024",benzinga,2.31,2.35,1.731601731601733,2.52,7.234042553191486,2.485,5.744680851063821,-0.6036217303822808,-2.8169014084506983,420919.0,226361.30952380953,1.8595006403058743,287.0,4.468085106382977
2024-03-28,2,1,1,True,True,"Cannabis Stock Gainers And Losers From March 27, 2024",benzinga,2.485,2.47,-0.6036217303822808,2.63,6.477732793522255,2.47,0.0,-2.024291497975719,15.38461538461538,452275.0,228721.87301587302,1.9774016102457008,197.0,1.4170040485829836
2024-04-03,2,0,2,False,True,"Older Patients Are Choosing Cannabis To Treat Chronic Pain, Arthritis, Anxiety And Insomnia, New Study Shows",benzinga,2.415,2.4,-0.6211180124223654,2.85,18.750000000000007,2.85,18.750000000000007,-6.315789473684216,-9.473684210526317,445796.0,230442.27777777778,1.934523492385777,336.0,5.208333333333334
2024-04-04,2,2,0,True,False,"Cannabis Stock Movers For April 3, 2024",benzinga,2.85,2.96,3.8596491228070127,2.965,0.16891891891891533,2.67,-9.797297297297298,-2.8089887640449342,-23.03370786516853,551592.0,232529.25396825396,2.3721402386441497,50.0,0.16891891891891533
2024-04-05,1,1,0,True,False,"Cannabis Stock Movers For April 4, 2024",benzinga,2.67,2.58,-3.3707865168539275,2.73,5.813953488372089,2.595,0.5813953488372141,-0.5780346820809296,-22.543352601156084,328946.0,235413.12698412698,1.397313753120401,4.0,5.813953488372089
2024-04-09,5,2,3,True,True,"NASDAQ-Listed Marijuana Stocks, Tilray, Canopy, Aurora Rally: What's Behind The Surge?",benzinga,2.58,2.12,-17.829457364341085,2.245,5.896226415094339,2.055,-3.066037735849054,-2.1897810218978284,-11.19221411192215,624207.0,235266.5,2.6531911683133806,6.0,5.896226415094339
2024-04-10,1,1,0,True,False,"Cannabis Stock Movers For April 9, 2024",benzinga,2.055,1.96,-4.6228710462287195,2.17,10.714285714285712,2.01,2.5510204081632564,-4.975124378109447,-10.945273631840784,235533.0,238173.39682539683,0.9889139725066252,59.0,10.714285714285712
2024-04-11,2,0,2,False,True,"Fed-Funded Study Finds Increase In Medical Marijuana Patient Enrollments, Chronic Pain Most Common Reason",benzinga,2.01,2.01,0.0,2.01,0.0,1.91,-4.975124378109447,-4.450261780104711,-4.188481675392662,239996.0,237136.30952380953,1.0120592687047083,0.0,0.0
2024-04-12,1,1,0,True,False,"Marijuana Stock Movers For April 11, 2024",benzinga,1.91,1.89,-1.0471204188481684,1.965,3.9682539682539777,1.825,-3.4391534391534364,-1.9178082191780779,-6.301369863013698,243602.0,238327.34126984127,1.0221319916634601,8.0,3.9682539682539777
2024-04-15,2,1,1,True,True,"Cannabis Stock Movers For April 12, 2024",benzinga,1.825,1.85,1.3698630136986376,1.86,0.540540540540541,1.79,-3.243243243243246,2.2346368715083815,-3.3519553072625725,240612.0,238912.90476190476,1.007111776736332,217.0,0.0
2024-04-16,1,0,1,False,True,What's Going On With Marijuana Grower Tilray's Stock?,benzinga,1.79,1.76,-1.6759776536312863,1.885,7.1022727272727275,1.83,3.9772727272727306,-6.557377049180333,-5.464480874316944,273838.0,239777.0158730159,1.1420527484795397,126.0,3.9772727272727306
2024-04-17,4,1,3,True,True,"No Cannabis Tax Relief In Canada, Tilray CEO Says This 'Hinders Our Ability To Compete With The Illicit Market'",benzinga,1.83,1.85,1.0928961748633887,1.86,0.540540540540541,1.71,-7.567567567567574,1.1695906432748548,0.8771929824561476,357904.0,241407.8650793651,1.4825697575442942,3.0,0.540540540540541
2024-04-18,1,1,0,True,False,"Marijuana Stock Movers For April 17, 2024",benzinga,1.71,1.75,2.3391812865497097,1.78,1.7142857142857157,1.73,-1.142857142857144,0.0,6.358381502890179,419075.0,243104.0873015873,1.7238500785883897,86.0,0.0
2024-04-19,1,0,1,False,True,'Cannabis Seizures At Checkpoints By U.S.-Mexico Border Frustrates State-Authorized Pot Industry' - Audacy Citing AP,benzinga,1.73,1.72,-0.5780346820809253,1.755,2.0348837209302277,1.73,0.5813953488372098,-0.28901734104045623,5.780346820809254,173108.0,245128.61904761905,0.7061925313843985,216.0,1.7441860465116297
2024-04-24,2,2,0,True,False,"Marijuana Stock Movers For April 23, 2024",benzinga,1.84,1.825,-0.8152173913043546,1.845,1.0958904109589052,1.83,0.27397260273973234,-4.371584699453555,-3.2786885245901667,241405.0,245079.27777777778,0.985007799063659,256.0,0.0
2024-04-25,1,0,1,False,True,"Cannabis Companies' Gains - U.S. Versus Canada: Averages Can Be Deceiving, Irrational Market Behavior To Blame?",benzinga,1.83,1.8,-1.6393442622950833,1.8,0.0,1.75,-2.77777777777778,1.7142857142857157,41.42857142857143,401042.0,245790.74603174604,1.6316399476984456,0.0,0.0
2024-04-26,3,1,2,True,True,"Marijuana Stock Movers For April 25, 2024",benzinga,1.75,1.81,3.4285714285714315,1.85,2.2099447513812174,1.78,-1.657458563535913,-0.5617977528089892,12.921348314606728,388838.0,247779.82539682538,1.5692883767968862,21.0,2.2099447513812174
2024-04-29,1,0,1,False,True,"Watching Shares Of Marijuana Stocks; Traders Circulate Comments From The TDR Podcast Saying ""We've Heard Rumors That Potentially That Announcement Could Be Coming This Week - Whatever The Decision May Be"", ""I'm Hearing From Some Sources That Pro-Marijuana Democratic Senators Are Saying It's Very Soon, As In Today Or Tomorrow. It Could Be Wishful Thinking Or Not.""",benzinga,1.78,1.81,1.6853932584269677,1.84,1.657458563535913,1.77,-2.2099447513812174,39.83050847457628,13.841807909604526,129235.0,249340.1349206349,0.5183080535395377,6.0,1.657458563535913
2024-04-30,2,0,2,False,True,DEA Moving To Reclassify Marijuana As Less Dangerous Drug,benzinga,1.77,1.77,0.0,2.51,41.80790960451976,2.475,39.83050847457628,-18.7878787878788,-15.555555555555564,1684466.0,249139.31746031746,6.761140783282025,348.0,2.25988700564972
2024-05-01,5,3,2,True,True,"Bullish Tuesday For Marijuana Stocks - Elixinol Wellness, Item 9 Labs Among Top Gainers",benzinga,2.475,2.3,-7.070707070707082,2.34,1.7391304347826104,2.01,-12.608695652173916,0.24875621890548946,1.9900497512437831,1635146.0,261751.55555555556,6.246938997284957,0.0,1.7391304347826104
2024-05-06,2,0,2,False,True,"""Florida GOP Formally Opposes Marijuana Legalization Ballot Initiative, Clearing Path For DeSantis To Fund 'Counter Message' Campaign"" - Marijuana Moment",benzinga,2.09,2.18,4.306220095693795,2.215,1.6055045871559492,2.05,-5.963302752293593,-3.17073170731706,-3.4146341463414562,120804.0,275151.8888888889,0.43904477809629994,72.0,0.6880733944953982
2024-05-07,2,2,0,True,False,Cannabis Stocks Retreat On New Rescheduling Order Developments: What's Going On?,benzinga,2.05,2.02,-1.463414634146332,2.075,2.7227722772277305,1.985,-1.7326732673267287,-2.267002518891695,-2.5188916876574328,896684.0,275228.44444444444,3.2579626782761473,17.0,2.7227722772277305
2024-05-08,1,1,0,True,False,"Marijuana Stock Movers For May 7, 2024",benzinga,1.985,1.965,-1.0075566750629732,2.0,1.7811704834605555,1.94,-1.2722646310432637,2.061855670103095,2.319587628865987,927646.0,280626.3253968254,3.3056271491573117,104.0,0.5089058524173032
2024-05-10,1,0,1,False,True,'DEA Appears To Question Marijuana's Medical Value Despite Rescheduling Recommendation' - Marijuana Moment,benzinga,1.98,1.985,0.25252525252525837,2.02,1.7632241813601974,1.935,-2.5188916876574328,2.583979328165377,6.459948320413436,115730.0,293254.22222222225,0.3946405242626041,27.0,1.7632241813601974
2024-05-13,1,0,1,False,True,"Cannabis Shops Could Launch This Year In Germany For 'Scientific Purposes,' Here's Why UK's Medical Marijuana Sales Are Soaring",benzinga,1.935,1.97,1.808785529715758,2.11,7.106598984771568,1.985,0.7614213197969607,4.785894206549117,6.801007556675064,65942.0,293058.77777777775,0.22501288137495362,106.0,2.53807106598985
2024-05-15,1,1,0,True,False,"Cannabis Stock Gainers And Losers From May 14, 2024",benzinga,2.08,2.11,1.4423076923076827,2.145,1.658767772511855,2.06,-2.3696682464454897,2.9126213592233037,-6.067961165048544,835290.0,296201.88095238095,2.8200023487841586,1.0,1.658767772511855
2024-05-16,5,0,5,False,True,'Justice Department Poised To Post Plans For Marijuana Reclassification; This Is The Next Step In The Rescheduling Process Begun By President Joe Biden In October 2022 That Is Set To Be The Largest Shift In Federal Drug Policy In Decades' - Politico,benzinga,2.06,2.05,-0.4854368932038947,2.23,8.780487804878058,2.12,3.4146341463414775,-6.839622641509433,-9.433962264150951,1178169.0,302032.126984127,3.9008068835734075,236.0,4.634146341463424
2024-05-17,3,2,1,True,True,Tilray Brands Discloses At-the-market Program To Fund Strategic And Accretive Acquisitions And Accelerate Expansion Plan Upon U.S. Cannabis Rescheduling When Effective,benzinga,2.12,2.06,-2.8301886792452855,2.06,0.0,1.975,-4.126213592233007,-2.0253164556962044,-5.06329113924051,630330.0,309784.1904761905,2.034739084105863,0.0,0.0
2024-05-20,3,2,1,True,True,"Cannabis Stock Movers For May 17, 2024",benzinga,1.975,2.005,1.518987341772142,2.005,0.0,1.935,-3.49127182044887,-0.7751937984496188,-5.167958656330754,269282.0,313593.7380952381,0.8586969932359406,0.0,0.0
2024-05-21,1,1,0,True,False,Easy-To-Trade Cannabis Stocks: Insights Into How Trading Activity Affects These Investments,benzinga,1.935,1.95,0.7751937984496073,1.96,0.5128205128205132,1.92,-1.5384615384615399,-2.3437499999999964,-4.166666666666659,66587.0,314637.0396825397,0.21163115463832385,3.0,0.5128205128205132
2024-05-23,1,0,1,False,True,What's Going On With Tilray Brands Stock?,benzinga,1.875,1.86,-0.7999999999999948,1.875,0.8064516129032205,1.835,-1.3440860215053836,0.27247956403270385,-1.9073569482288784,96723.0,314462.8968253968,0.3075815969910903,57.0,0.8064516129032205
2024-06-03,1,0,1,False,True,Here's Where To Buy Legal Weed While Getting A Tattoo And A Beer: New Cannabis Stores In US And More,benzinga,1.805,1.82,0.8310249307479294,1.83,0.5494505494505499,1.79,-1.6483516483516498,-0.5586592178770954,-0.2793296089385539,63743.0,315961.4285714286,0.2017429794776035,10.0,0.5494505494505499
2024-06-04,1,1,0,True,False,Cannabis Slowdown In Canada: Analyst Spotlights What Still Sells And Where The Money Is Going,benzinga,1.79,1.795,0.27932960893854153,1.795,0.0,1.78,-0.8356545961002733,0.0,-0.5617977528089892,99417.0,315782.5,0.3148274524395747,0.0,0.0
2024-06-05,1,1,0,True,False,"Chicago Cannabis Company Green Thumb Proposes Merger With Boston Beer, Eyes Stock Listing",benzinga,1.78,1.77,-0.5617977528089892,1.79,1.12994350282486,1.78,0.56497175141243,0.2808988764044884,0.5617977528089892,56713.0,315655.6111111111,0.1796673273139978,368.0,0.28248587570620864
2024-06-06,1,0,1,False,True,"Tilray Ramps Up Its Cannabis Portfolio In Canada, Wins International Spirits Competition",benzinga,1.78,1.78,0.0,1.81,1.6853932584269677,1.785,0.2808988764044884,-0.8403361344537761,-2.521008403361341,72717.0,313541.25396825396,0.23192163416990924,255.0,0.0
2024-06-07,1,0,1,False,True,"Germany Sets THC Limits For Drivers, Opposition Groups Say It's Too High",benzinga,1.785,1.79,0.2801120448179336,1.81,1.1173184357541908,1.77,-1.1173184357541908,1.12994350282486,0.0,178416.0,312408.70634920633,0.5710980404002216,83.0,0.5586592178770954
2024-06-10,1,1,0,True,False,How These 2 Nasdaq-Listed Marijuana Companies Found A Way To Raise $250M Without Tanking Their Stock,benzinga,1.77,1.76,-0.56497175141243,1.79,1.7045454545454561,1.79,1.7045454545454561,-2.793296089385477,-2.5139664804469235,126156.0,311162.1984126984,0.4054348524452758,366.0,0.284090909090903
2024-06-12,1,0,1,False,True,"Cannabis Products To Try This Summer, Here's What Tilray Has In Store",benzinga,1.74,1.78,2.2988505747126458,1.82,2.247191011235957,1.77,-0.5617977528089892,-1.4124293785310684,-4.51977401129944,357694.0,308675.4285714286,1.1588029590027065,254.0,0.8426966292134775
2024-06-17,1,0,1,False,True,Medical Cannabis Packaging Market Projected To Reach $117.2B By 2032 Amid Sustainability Push,benzinga,1.7,1.71,0.5882352941176475,1.71,0.0,1.69,-1.1695906432748548,0.0,-1.1834319526627228,81164.0,310194.20634920633,0.26165543501037625,0.0,0.0
2024-06-18,1,1,0,True,False,Cannabis Found Less Harmful Than Alcohol In New Study: Where Is The Demand Heading? Investor Market Tips,benzinga,1.69,1.695,0.2958579881656873,1.72,1.4749262536873105,1.69,-0.29498525073746995,-0.29585798816567416,-1.1834319526627228,57504.0,307269.3888888889,0.18714522851735782,24.0,1.4749262536873105
2024-06-26,1,1,0,True,False,Canadian Vs. U.S. Cannabis Companies: Who Is Winning The Market Race To Weed Profits?,benzinga,1.63,1.62,-0.6134969325153244,1.69,4.3209876543209775,1.69,4.3209876543209775,2.0710059171597717,-0.8875739644970357,110320.0,294390.0238095238,0.3747409595352974,284.0,0.6172839506172707
2024-06-27,1,1,0,True,False,"Bullish Wednesday For Marijuana Stocks - Affinor Growers, Blueberries Medical Among Top Gainers",benzinga,1.69,1.665,-1.479289940828397,1.735,4.204204204204208,1.725,3.603603603603607,-3.188405797101458,-4.0579710144927565,197809.0,292992.71428571426,0.6751328287539086,365.0,3.603603603603607
2024-06-28,1,0,1,False,True,Is Tilray Really Worth $2B? Analysts Sees Path To $10B Market Opportunity,benzinga,1.725,1.715,-0.5797101449275368,1.715,0.0,1.67,-2.6239067055393672,0.29940119760479733,3.5928143712574885,215379.0,291656.9285714286,0.7384669414676783,0.0,0.0
2024-07-01,2,2,0,True,False,"Bearish Friday For Marijuana Stocks - Global Compliance, 1933 Industries Among Top Gainers",benzinga,1.67,1.695,1.4970059880239601,1.725,1.7699115044247802,1.675,-1.1799410029498536,-1.1940298507462697,2.9850746268656745,108734.0,291175.11904761905,0.37343163233056853,9.0,1.7699115044247802
2024-07-03,1,0,1,False,True,Decibel's Dominance In Pre-Rolls Tested By Market Shifts And 16% Revenue Drop: What Investors Need To Know,benzinga,1.655,1.665,0.6042296072507558,1.79,7.5075075075075075,1.73,3.9039039039039007,-0.28901734104045623,1.445086705202307,359658.0,290222.3888888889,1.2392496711812762,82.0,5.705705705705704
2024-07-05,3,2,1,True,True,"Cannabis Stock Gainers And Losers From July 3, 2024",benzinga,1.73,1.71,-1.1560693641618507,1.745,2.0467836257310026,1.725,0.8771929824561476,0.8695652173912987,5.797101449275354,113320.0,291496.70634920633,0.38875224841904477,3.0,2.0467836257310026
2024-07-08,1,0,1,False,True,"'California Legislature Approves Bill To Break Psychedelics Research Logjam, Sending It To Governor' - Marijuana Moment",benzinga,1.725,1.74,0.8695652173912987,1.795,3.160919540229881,1.74,0.0,0.8620689655172358,5.747126436781615,122250.0,288862.5317460318,0.42321168917636687,39.0,3.160919540229881
2024-07-09,3,1,2,True,True,Tilray Medical Study Highlights Benefits of Cannabis for Patients Over 50,benzinga,1.74,1.755,0.8620689655172358,1.85,5.413105413105425,1.755,0.0,3.988603988603993,6.8376068376068435,475939.0,288611.85714285716,1.6490625323283916,51.0,5.413105413105425
2024-07-10,1,1,0,True,False,Tilray Brands Says Good Supply Cannabis Brand Has Released Its Updated Lineup Of Flavourful 1G 510 Vapes,benzinga,1.755,1.79,1.9943019943020026,1.835,2.5139664804469235,1.825,1.955307262569828,0.8219178082191849,4.931506849315073,88089.0,290548.88095238095,0.30318134322615825,149.0,0.5586592178770954
2024-07-11,1,1,0,True,False,"Bearish Sentiment Across The Cannabis Space - Check Full Movers For July 10, 2024",benzinga,1.825,1.875,2.739726027397263,1.875,0.0,1.84,-1.8666666666666623,1.9021739130434738,5.163043478260868,97699.0,289471.22222222225,0.3375085068905333,0.0,0.0
2024-07-12,1,1,0,True,False,Does Size Matter? These Two Small-Cap Cannabis Stocks Are Masters Of Cash Flow And Credit Management,benzinga,1.84,1.875,1.9021739130434738,1.875,0.0,1.875,0.0,2.1333333333333355,1.3333333333333286,71243.0,286320.54761904763,0.24882251934915103,0.0,0.0
2024-07-15,1,0,1,False,True,Leaked Documents: Czech Republic Plans To Set Up Legal Recreational Cannabis Market,benzinga,1.875,1.83,-2.3999999999999964,1.955,6.830601092896174,1.915,4.644808743169397,1.044386422976502,-4.438642297650128,303533.0,283352.873015873,1.071219066068889,350.0,1.36612021857923
2024-07-16,1,0,1,False,True,When Is Cannabis Giant Tilray Reporting Earnings And What Should Investors Expect?,benzinga,1.915,1.93,0.7832898172323709,1.95,1.0362694300518145,1.935,0.25906735751295934,-1.8087855297157693,-7.493540051679587,158287.0,279877.98412698414,0.5655571676841262,10.0,1.0362694300518145
2024-07-17,2,1,1,True,True,Cannabis Stocks: Canadian Companies Outperformed American Counterparts Last Week,benzinga,1.935,1.88,-2.84237726098192,2.01,6.914893617021272,1.9,1.0638297872340436,-3.6842105263157814,0.5263157894736847,166336.0,277412.0238095238,0.5995991007015953,60.0,6.914893617021272
2024-07-22,4,2,2,True,True,Tilray's Aphria RX Receives First Cannabis Cultivation License Under Germany's New Cannabis Act,benzinga,1.79,1.84,2.793296089385477,1.915,4.076086956521737,1.91,3.8043478260869477,-0.7853403141361206,-7.068062827225131,113767.0,273896.15873015876,0.41536544553033594,364.0,1.0869565217391313
2024-07-23,2,2,0,True,False,"Marijuana Stock Movers For July 22, 2024",benzinga,1.91,1.905,-0.26178010471203633,1.955,2.624671916010501,1.895,-0.5249343832021002,-5.5408970976253284,-2.9023746701846935,85871.0,272419.5,0.315216054651007,157.0,1.8372703412073448
2024-07-24,2,1,1,True,True,Tilray Brands Announced Another Milestone Achievement In Medical Cannabis In Europe,benzinga,1.895,1.87,-1.319261213720312,1.87,0.0,1.79,-4.278074866310163,-0.8379888268156493,2.2346368715083815,211879.0,271987.90476190473,0.7790015522398931,0.0,0.0
2024-07-25,1,1,0,True,False,"Cannabis Stock Gainers And Losers From July 24, 2024",benzinga,1.79,1.79,0.0,1.845,3.0726256983240186,1.775,-0.8379888268156493,3.6619718309859253,13.521126760563392,89543.0,273062.40476190473,0.32792137781865843,181.0,0.837988826815637
2024-07-29,4,2,2,True,True,"Bullish Friday For Marijuana Stocks - GreenGro Technologies, Leafbuyer Techs Among Top Gainers",benzinga,1.84,1.845,0.27173913043477677,1.89,2.439024390243899,1.83,-0.8130081300812955,10.109289617486342,8.469945355191259,240992.0,271757.20634920633,0.8867915711877269,16.0,2.439024390243899
2024-07-30,5,4,1,True,True,"Cannabis Stock Movers For July 29, 2024",benzinga,1.83,2.015,10.109289617486342,2.145,6.451612903225801,2.015,0.0,0.24813895781637188,-7.6923076923076925,533149.0,272686.4126984127,1.9551725908311215,44.0,6.451612903225801
2024-07-31,2,1,1,True,True,"Cannabis Stock Movers For July 30, 2024",benzinga,2.015,2.015,0.0,2.05,1.736972704714625,2.02,0.24813895781637188,-1.7326732673267287,-13.861386138613863,400857.0,274825.5317460318,1.45858718967361,212.0,0.49627791563274376
2024-08-05,1,1,0,True,False,"Marijuana Stock Movers For August 2, 2024",benzinga,1.86,1.7,-8.602150537634417,1.785,4.999999999999998,1.74,2.35294117647059,4.02298850574713,6.609195402298849,463441.0,281495.0714285714,1.646355645404601,174.0,2.941176470588238
2024-08-06,1,1,0,True,False,"Cannabis Stock Gainers And Losers From August 5, 2024",benzinga,1.74,1.8,3.448275862068969,1.82,1.111111111111112,1.81,0.555555555555556,-2.7624309392265216,-1.1049723756906087,327763.0,283127.94444444444,1.157649770824066,300.0,0.27777777777777185
2024-08-07,1,1,0,True,False,"Marijuana Stock Movers For August 6, 2024",benzinga,1.81,1.845,1.933701657458559,1.845,0.0,1.76,-4.607046070460703,5.397727272727272,1.1363636363636374,378467.0,283793.20634920633,1.3336013390479051,0.0,0.0
2024-08-09,1,1,0,True,False,"Cannabis Stock Movers For August 8, 2024",benzinga,1.855,1.83,-1.3477088948787015,1.84,0.5464480874316944,1.79,-2.1857923497267775,-0.5586592178770954,6.703910614525133,376189.0,287698.01587301586,1.3075828794246613,14.0,0.5464480874316944
2024-08-13,2,1,1,True,True,These 3 Cannabis Companies Hold Cultivation Licenses In Germany: A ~$1.8B Market Opportunity?,benzinga,1.78,1.79,0.5617977528089892,1.89,5.5865921787709425,1.86,3.9106145251396685,2.688172043010743,4.569892473118277,762669.0,290948.65873015876,2.621318150524075,246.0,1.6759776536312863
2024-08-14,5,3,2,True,True,Cannabis And Heart Attack Paradox: New Study Reveals Better Outcomes For Weed Users,benzinga,1.86,1.87,0.5376344086021511,1.955,4.545454545454543,1.91,2.13903743315507,1.8324607329843006,1.3089005235602165,490833.0,295355.0873015873,1.6618403443947118,209.0,2.6737967914438405
2024-08-21,1,1,0,True,False,"Marijuana Stock Movers For August 20, 2024",benzinga,1.865,1.86,-0.2680965147453026,1.895,1.8817204301075225,1.885,1.3440860215053716,-0.26525198938992656,-1.0610079575596827,436144.0,298820.3333333333,1.459552618574595,285.0,1.612903225806441
2024-08-22,2,0,2,False,True,"Tilray Is Not Giving Up On Cannabis, Ramps Up Its Canadian Portfolio On Heels Of Buying Four US Breweries",benzinga,1.885,1.89,0.2652519893899148,1.91,1.0582010582010593,1.88,-0.5291005291005296,2.1276595744680873,-6.648936170212766,253861.0,299442.04761904763,0.8477800696947004,24.0,1.0582010582010593
